{
  "region": "US",
  "generated_at": "2025-11-03T06:11:32Z",
  "MARKET_NORMS": {
    "profile": "Pop"
  },
  "MVP": {
    "tempo_band_bpm": "123-127",
    "runtime_sec": 174.2,
    "ttc_sec": null,
    "exposures": null
  },
  "Baseline": {
    "active_profile": "Pop",
    "effective_utc": "2025-11-03T06:11:32Z",
    "previous_profile": null,
    "pinned": true,
    "note": "Pinned for reproducible analyses"
  },
  "Policies": {
    "SCORING_GUARDS": {
      "active": true,
      "caps": {
        "Market": 0.58,
        "Emotional": 0.58
      }
    },
    "GOLDILOCKS_POLICY": {
      "active": true,
      "priors": {
        "Market": 0.5,
        "Emotional": 0.5
      }
    }
  },
  "Known_Gaps": []
}